{
  "id": "io.pilot.plainweb",
  "name": "Plainweb",
  "tagline": "Any web page as clean Markdown — no HTML, no JS, one call",
  "description": "Plainweb is a Pilot-owned URL→Markdown service: give it any web page and get back clean, accurate Markdown — no HTML, no JavaScript, just plain text structured as Markdown.\n\nWhat an agent gets:\n- **One call** — `plainweb.fetch(url)` fetches the page and returns it as Markdown (GFM tables, fenced code with language, task lists). The target URL goes straight in the path.\n- **Accurate extraction** — a cost-aware static→headless-Chrome fetch ladder (most pages never launch Chrome), go-readability primary (preserves code blocks and tables) with go-trafilatura fallback, converted via html-to-markdown v2.\n- **Scheme-less OK** — bare hosts like `example.com` are sanitized to `https://`.\n\nGood to know:\n- **Free to call — no API key required.** Public endpoints are available to every caller.\n- **Rate limit:** anonymous callers get **1000 requests/second** (burst 2000); a master key only elevates a caller past that limit.\n- The reply is `text/markdown`, returned by the adapter as `{ \"content_type\", \"content\" }` (the Markdown is in `content`).\n- In-house Pilot Protocol tool, deployed on Cloud Run.",
  "categories": [
    "web"
  ],
  "primary_category": "web",
  "keywords": [
    "plainweb",
    "markdown",
    "web",
    "fetch",
    "scrape",
    "extract",
    "readability",
    "html",
    "url",
    "content"
  ],
  "version": "1.0.0",
  "vendor": "Pilot Protocol",
  "vendor_url": "https://pilotprotocol.network",
  "license": "Proprietary",
  "source_url": "",
  "homepage": "https://pilotprotocol.network",
  "methods": [
    {
      "name": "plainweb.fetch",
      "summary": "Fetch any web page and return it as clean Markdown — no HTML, no JavaScript. Pass the full target URL as `url`; it is placed verbatim in the request path (GET /<url>). Scheme-less hosts (e.g. example.com) are sanitized to https://. The reply is `{\"content_type\":\"text/markdown; charset=utf-8\",\"content\":\"<markdown>\"}`. Open and free — no API key needed.",
      "example": "",
      "gated": ""
    },
    {
      "name": "plainweb.help",
      "summary": "Discovery: every method with params, kind, and latency class.",
      "example": "",
      "gated": ""
    }
  ],
  "changelog": [
    {
      "version": "1.0.0",
      "date": "",
      "notes": [
        "Released v1.0.0"
      ]
    }
  ],
  "grants": [
    "fs.read:$APP/config.json",
    "net.dial:plainweb-hu4fob755a-uc.a.run.app",
    "audit.log:*"
  ],
  "limits": [],
  "bundles": [
    {
      "platform": "darwin-arm64",
      "bytes": 4783331
    },
    {
      "platform": "darwin-amd64",
      "bytes": 4783331
    },
    {
      "platform": "linux-arm64",
      "bytes": 5437892
    },
    {
      "platform": "linux-amd64",
      "bytes": 5035085
    }
  ],
  "installed_bytes": 8625202,
  "depends": [],
  "protection": "shareable",
  "featured": false,
  "in_catalogue": true,
  "icon": {
    "mode": "image",
    "img": "/appicons/io.pilot.plainweb.png",
    "file": "",
    "fit": "contain",
    "pos": "center",
    "color": "#ffffff",
    "ink": false,
    "hue": 200
  },
  "min_pilot_version": "1.0.0",
  "runtimes": [
    "go"
  ],
  "published_at": "",
  "updated_at": "",
  "product_demo": {
    "skill": "io.pilot.plainweb",
    "title": "Full usage demo",
    "when_to_use": "When you need to read a public web page as clean Markdown (no HTML, no JS) in one call — for summarizing, extracting, or feeding article content to a model.",
    "metered": false,
    "quickstart": {
      "title": "",
      "goal": "Fetch a URL as Markdown",
      "command": "pilotctl appstore call io.pilot.plainweb plainweb.fetch '{\"url\":\"https://example.com\"}'",
      "expect": "{\"content_type\":\"text/markdown; charset=utf-8\",\"content\":\"# Example Domain\\n...\"}",
      "cost": "",
      "note": ""
    },
    "examples": [
      {
        "title": "Scheme-less host (sanitized to https://)",
        "goal": "",
        "command": "pilotctl appstore call io.pilot.plainweb plainweb.fetch '{\"url\":\"en.wikipedia.org/wiki/Markdown\"}'",
        "expect": "{\"content\":\"# Markdown\\n\\nMarkdown is a lightweight markup language...\"}",
        "cost": "",
        "note": ""
      },
      {
        "title": "Read an article for summarization",
        "goal": "",
        "command": "pilotctl appstore call io.pilot.plainweb plainweb.fetch '{\"url\":\"https://go.dev/doc/effective_go\"}'",
        "expect": "clean Markdown of the page (GFM tables, fenced code) in the content field",
        "cost": "",
        "note": ""
      },
      {
        "title": "Front page of a news/link site",
        "goal": "",
        "command": "pilotctl appstore call io.pilot.plainweb plainweb.fetch '{\"url\":\"https://news.ycombinator.com\"}'",
        "expect": "{\"content_type\":\"text/markdown; charset=utf-8\",\"content\":\"...\"}",
        "cost": "",
        "note": ""
      }
    ],
    "cost": null,
    "gotchas": [
      "The target URL goes verbatim into the request path (GET /<url>); pass it as the url param.",
      "Scheme-less hosts (e.g. example.com) are sanitized to https://.",
      "The Markdown body is in the content field of the reply, not the top level.",
      "Free and open — no API key required."
    ],
    "next": [
      "io.pilot.plainweb plainweb.help '{}'"
    ]
  }
}
