{
  "id": "io.telepat.ideon-free",
  "name": "Ideon (Free)",
  "tagline": "Free long-form article generation for agents",
  "description": "Free article generation for agents: ideon-free.generate(idea) returns a jobId; ideon-free.poll(jobId) returns the finished markdown article. A thin adapter over Ideon's ideon_write — no payment.",
  "categories": [
    "ai"
  ],
  "primary_category": "ai",
  "keywords": [
    "writing",
    "article",
    "generate",
    "markdown"
  ],
  "version": "0.3.1",
  "vendor": "Telepat",
  "vendor_url": "https://telepat.io",
  "license": "Proprietary",
  "source_url": "https://telepat.io",
  "homepage": "https://telepat.io",
  "methods": [
    {
      "name": "ideon-free.generate",
      "summary": "",
      "example": "",
      "gated": ""
    },
    {
      "name": "ideon-free.poll",
      "summary": "",
      "example": "",
      "gated": ""
    },
    {
      "name": "ideon-free.help",
      "summary": "",
      "example": "",
      "gated": ""
    }
  ],
  "changelog": [
    {
      "version": "0.3.1",
      "date": "",
      "notes": [
        "Thin adapter over Ideon ideon_write — no payment"
      ]
    }
  ],
  "grants": [
    "audit.log:*",
    "net.dial:ideon-mcp.telepat.io"
  ],
  "limits": [],
  "bundles": [
    {
      "platform": "darwin-arm64",
      "bytes": 0
    },
    {
      "platform": "darwin-amd64",
      "bytes": 0
    },
    {
      "platform": "linux-arm64",
      "bytes": 0
    },
    {
      "platform": "linux-amd64",
      "bytes": 0
    }
  ],
  "installed_bytes": 13824,
  "depends": [],
  "protection": "guarded",
  "featured": false,
  "in_catalogue": true,
  "icon": {
    "mode": "image",
    "img": "/appicons/io.telepat.ideon-free.png",
    "file": "",
    "fit": "cover",
    "pos": "center",
    "color": "#0b0b0a",
    "ink": false,
    "hue": 265,
    "mark": null
  },
  "min_pilot_version": "1.0.0",
  "runtimes": [
    "go"
  ],
  "published_at": "",
  "updated_at": "",
  "product_demo": {
    "skill": "io.telepat.ideon-free",
    "title": "Full usage demo",
    "when_to_use": "When you need a finished long-form Markdown article generated from a one-line idea — kick off generation, then poll for the completed title, slug, and body. Free, no payment.",
    "metered": false,
    "quickstart": {
      "title": "",
      "goal": "Start an article generation job",
      "command": "pilotctl appstore call io.telepat.ideon-free ideon-free.generate '{\"idea\":\"How vector databases work\"}'",
      "expect": "{\"jobId\":\"<uuid>\"}",
      "cost": "",
      "note": ""
    },
    "examples": [
      {
        "title": "Generate with style + length hints",
        "goal": "",
        "command": "pilotctl appstore call io.telepat.ideon-free ideon-free.generate '{\"idea\":\"A beginner guide to Rust ownership\",\"style\":\"tutorial\",\"length\":\"long\"}'",
        "expect": "{\"jobId\":\"<uuid>\"}",
        "cost": "",
        "note": ""
      },
      {
        "title": "Poll while still running",
        "goal": "",
        "command": "pilotctl appstore call io.telepat.ideon-free ideon-free.poll '{\"jobId\":\"<uuid>\"}'",
        "expect": "{\"jobId\":\"<uuid>\",\"status\":\"pending\"}",
        "cost": "",
        "note": ""
      },
      {
        "title": "Poll once finished",
        "goal": "",
        "command": "pilotctl appstore call io.telepat.ideon-free ideon-free.poll '{\"jobId\":\"<uuid>\"}'",
        "expect": "{\"status\":\"done\",\"ok\":true,\"title\":\"...\",\"slug\":\"...\",\"article\":\"# ...markdown...\"}",
        "cost": "",
        "note": ""
      }
    ],
    "cost": null,
    "gotchas": [
      "Generation is async: generate returns a jobId immediately; poll it until status is \"done\" (~60–90s for a real run).",
      "poll returns status \"pending\" until ready, then the finished Markdown in the article field.",
      "An unknown or expired jobId polls back status \"error\".",
      "Free — a thin adapter over Ideon's ideon_write (backend ideon-mcp.telepat.io), rate-limited to 30 calls/min."
    ],
    "next": [
      "io.telepat.ideon-free ideon-free.help '{}'"
    ]
  }
}
